### ISSUE TITLE
packets leaking

### ISSUE THREAD

**Issue by powerman** [schwabe/ics-openvpn#346]
This may be related to #195, but I didn't see OpenVPN reconnection in log.

I've phone connected by both Wi-Fi and OpenVPN to same router. Wi-Fi uses 192.168.6.x, OpenVPN uses 10.80.77.x. OpenVPN for Android configured to "Route/IPv4/Default route (route all traffic to VPN)" (not sure how exactly this option is named in English). Also I've AFWall+, which is configured to allow access to Wi-Fi only for "OpenVPN for Android", all other allowed apps has access only to VPN.
I'm using CyanogenMod 11 (4.4.4).

With these settings I sometimes see this in router logs:

> kern.debug: antispoof: IN=eth.wifi OUT= MAC=xx:xx:xx:xx:xx:xx:xx:xx:xx:xx:xx:xx:xx:xx SRC=10.80.77.6 DST=10.80.77.1 LEN=40 TOS=0x02 PREC=0x00 TTL=64 ID=0 DF PROTO=TCP SPT=2222 DPT=39238 WINDOW=0 RES=0x00 RST URGP=0

The "antispoof" rule triggered by non-192.168.6.x traffic on Wi-Fi interface. The port 2222 on phone is used by SSHelper (ssh daemon). Also it's strange I got this in router logs in about a minute _after SSHelper stops and exits_.

**Comment by plaisthos** [comment]
well. I am not sure what is really going in your case but if VPN Ips are appearing on non  VPN interfaces that is something only Android has control over. It is more a bug in Android than everything else.

**Comment by powerman** [comment]
Well, this problem is still there. I'm now using OpenVPN for Android 0.6.44 (latest in FDroid) and CM-11-20151108-NIGHTLY-i9305 (it's 4.4.4) on same Samsung Galaxy S3 (i9305).

I doubt it's Android kernel bug. Thing is, I'm also using AFWall+, and only application which is allowed to use WiFi network interface is OpenVPN - all other apps including kernel itself are either don't have access to internet or have access **only** to VPN interface. So, when I see on my router packets with SRC IP of phone's VPN interface on router's WiFi interface that means **these packets was sent by OpenVPN application on phone** because packets sent from all other processes using that interface will be blocked by AFWall+.

According to Wireshark on router traffic looks this way: normal OpenVPN traffic sent between phone's WiFi IP and router's WiFi IP with occasional TCP ACK, TCP Dup ACK and TCP RST packets sent **from phone's VPN IP to remote server on internet** - i.e. these packets are part of normal TCP stream inside VPN traffic which occasionally was sent to WiFi interface without wrapping them by OpenVPN packet first. And Dup ACK and RST means this result in hang and reset TCP connection on phone, i.e. these packets wasn't duplicated and sent twice - once normally inside OpenVPN packet and second as is without wrapping by OpenVPN packet - because if that was the case we shouldn't see Dup ACK and RST.

Please reopen this issue and investigate. I'll be glad to help you with debugging if you'll provide instructions.

**Comment by schwabe** [comment]
I do not know AFWall+ but the bug could also in that app. Policy routing is tricky.

But openvpn has no way of generating A TCP RST packet from the VPN IP. It can only write to the tun interface which creates traffic going to the phone and is otherwise limited as any other non privileged app. Generating a TCP RST is simply not possible with the rights the app has.

**Comment by powerman** [comment]
I've considered possibility of bug in AFWall+, but I see same behaviour with disabled firewall, so this is very unlikely.

The TCP RST packets isn't "generated" by OpenVPN, they're generated by some other application (actually by linux kernel on behalf of that app) which access internet, then these packets are intercepted by OpenVPN application just like all other packets, but after that some of these packets wasn't wrapped by OpenVPN packet before sending them into tun interface.

It looks like bug somewhere between code which intercept original TCP packets which should be sent from phone and code which send packets to tun interface - probably some race condition bug which sometimes result in passing packets from input to output as is, without wrapping them by OpenVPN packet.

**Comment by schwabe** [comment]
Anything that is send into the tun interface is treated as an incoming packet by the kernel. All packets going to that interface are not wrapped packets. They are the packets coming from the VPN server. Even if the app would send a TCP RST packet form the VPN IP to an outside interface to the tun device, the kernel would just drop it.

**Comment by powerman** [comment]
Yeah, sorry, I've used the wrong terms. Here is what I mean, once again, correct me if I misunderstood something:
- phone has `wlan0` WiFi interface, only app allowed (by iptables configured by AFWall+) to send packets into that interface is OpenVPN for Android
- phone has `tun0` VPN interface, a lot of other apps allowed to send packets into that interface
- my WiFi router also runs OpenVPN server, so it also has two similar interfaces (for WiFi and VPN)
- my router receives packet from phone, which SRC IP is phone's `tun0` interface's IP, but this packet comes from router's WiFi interface, not VPN interface

So, here is my guess how it may happens:
- some app on phone correctly send packet to phone's `tun0` interface, I think so because:
  - it's only interface allowed for that app
  - packet seen on router has SRC IP of that `tun0` interface
- all packets sent by all other apps and kernel to `tun0` interface are:
  1. received by OpenVPN for Android app
  2. wrapped by OpenVPN packet (or converted into OpenVPN packet, not sure about right term) by OpenVPN for Android app **(<-- I suppose this step is skipped for some packets)**
  3. sent into `wlan0` interface on phone by OpenVPN for Android app

**Comment by schwabe** [comment]
I think your first assumption is wrong. Packets are also sent to other interfaces. If you setup a VPN you will also see some packet with the source of wifi ip on your VPN tunnel. 

The kernel for whatever reason decided to route a packet with a source IP of the tun interface to the wifi interface. The app never gets the packet from the tun interface.

And there is no way that the app can skip that step ii. With only a UDP socket open you simply cannot send unwrapped packets. Stop persisting on the thought. If you do not believe me, please go ahead read up a bit more about tun interfaces and Unix sockets.

**Comment by powerman** [comment]
> The kernel for whatever reason decided to route a packet with a source IP of the tun interface to the wifi interface. The app never gets the packet from the tun interface.

Well, this is also possible. I've tried to confirm this theory with tcpdump running on phone.
At a glance it looks like this issue happens for half-closed TCP connections: after phone close it's side of connection by sending TCP FIN, all other packets sent by phone on this connection (ACK and RST as replies to data received by phone) are routed to WiFi interface instead of VPN. Here are two examples (the 10.80.77.6 is phone's tun0 IP):
- First

```
===== tun0
10:56:35.844592 IP 10.80.77.6.48355 > 208.71.187.83.443: Flags [S], seq 2937138706, win 14600, options [mss 1460,sackOK,TS val 1250599 ecr 0,nop,wscale 6], length 0
10:56:35.995457 IP 208.71.187.83.443 > 10.80.77.6.48355: Flags [S.], seq 2320964395, ack 2937138707, win 4056, options [mss 1352,nop,wscale 2,nop,nop,TS val 3230050445 ecr 1250599,sackOK,eol], length 0
10:56:35.995581 IP 10.80.77.6.48355 > 208.71.187.83.443: Flags [.], ack 1, win 229, options [nop,nop,TS val 1250630 ecr 3230050445], length 0
10:56:35.997481 IP 10.80.77.6.48355 > 208.71.187.83.443: Flags [P.], seq 1:185, ack 1, win 229, options [nop,nop,TS val 1250630 ecr 3230050445], length 184
10:56:36.145491 IP 208.71.187.83.443 > 10.80.77.6.48355: Flags [.], seq 1:1341, ack 185, win 1014, options [nop,nop,TS val 3230050599 ecr 1250630], length 1340
10:56:36.145622 IP 10.80.77.6.48355 > 208.71.187.83.443: Flags [.], ack 1341, win 274, options [nop,nop,TS val 1250660 ecr 3230050599], length 0
10:56:36.146057 IP 208.71.187.83.443 > 10.80.77.6.48355: Flags [.], seq 1341:2681, ack 185, win 1014, options [nop,nop,TS val 3230050599 ecr 1250630], length 1340
10:56:36.146144 IP 10.80.77.6.48355 > 208.71.187.83.443: Flags [.], ack 2681, win 319, options [nop,nop,TS val 1250660 ecr 3230050599], length 0
10:56:36.146322 IP 208.71.187.83.443 > 10.80.77.6.48355: Flags [P.], seq 2681:3792, ack 185, win 1014, options [nop,nop,TS val 3230050599 ecr 1250630], length 1111
10:56:36.146392 IP 10.80.77.6.48355 > 208.71.187.83.443: Flags [.], ack 3792, win 364, options [nop,nop,TS val 1250660 ecr 3230050599], length 0
10:56:36.149499 IP 10.80.77.6.48355 > 208.71.187.83.443: Flags [P.], seq 185:499, ack 3792, win 364, options [nop,nop,TS val 1250660 ecr 3230050599], length 314
10:56:36.300881 IP 208.71.187.83.443 > 10.80.77.6.48355: Flags [.], ack 499, win 1138, options [nop,nop,TS val 3230050750 ecr 1250660], length 0
10:56:36.301150 IP 208.71.187.83.443 > 10.80.77.6.48355: Flags [P.], seq 3792:3839, ack 499, win 1138, options [nop,nop,TS val 3230050753 ecr 1250660], length 47
10:56:36.304899 IP 10.80.77.6.48355 > 208.71.187.83.443: Flags [P.], seq 499:785, ack 3839, win 364, options [nop,nop,TS val 1250691 ecr 3230050753], length 286
10:56:36.456513 IP 208.71.187.83.443 > 10.80.77.6.48355: Flags [.], ack 785, win 1210, options [nop,nop,TS val 3230050905 ecr 1250691], length 0
10:56:36.459126 IP 208.71.187.83.443 > 10.80.77.6.48355: Flags [P.], seq 3839:4134, ack 785, win 1210, options [nop,nop,TS val 3230050911 ecr 1250691], length 295
10:56:36.495086 IP 10.80.77.6.48355 > 208.71.187.83.443: Flags [.], ack 4134, win 410, options [nop,nop,TS val 1250730 ecr 3230050911], length 0
10:56:36.710714 IP 10.80.77.6.48355 > 208.71.187.83.443: Flags [P.], seq 785:812, ack 4134, win 410, options [nop,nop,TS val 1250773 ecr 3230050911], length 27
10:56:36.711182 IP 10.80.77.6.48355 > 208.71.187.83.443: Flags [F.], seq 812, ack 4134, win 410, options [nop,nop,TS val 1250773 ecr 3230050911], length 0
10:56:36.852104 IP 208.71.187.83.443 > 10.80.77.6.48355: Flags [.], ack 812, win 1216, options [nop,nop,TS val 3230051312 ecr 1250773], length 0
10:56:36.854071 IP 208.71.187.83.443 > 10.80.77.6.48355: Flags [F.], seq 4134, ack 812, win 1216, options [nop,nop,TS val 3230051312 ecr 1250773], length 0

===== wlan0
10:56:36.854165 IP 10.80.77.6.48355 > 208.71.187.83.443: Flags [.], ack 2320968530, win 410, options [nop,nop,TS val 1250801 ecr 3230051312], length 0

===== tun0
10:56:36.854975 IP 208.71.187.83.443 > 10.80.77.6.48355: Flags [.], ack 813, win 1216, options [nop,nop,TS val 3230051312 ecr 1250773], length 0
10:56:37.852118 IP 208.71.187.83.443 > 10.80.77.6.48355: Flags [F.], seq 4134, ack 813, win 1216, options [nop,nop,TS val 3230052312 ecr 1250773], length 0

===== wlan0
10:56:37.852228 IP 10.80.77.6.48355 > 208.71.187.83.443: Flags [.], ack 1, win 410, options [nop,nop,TS val 1251001 ecr 3230051312], length 0

===== tun0
10:56:39.852489 IP 208.71.187.83.443 > 10.80.77.6.48355: Flags [F.], seq 4134, ack 813, win 1216, options [nop,nop,TS val 3230054312 ecr 1250773], length 0

===== wlan0
10:56:39.852638 IP 10.80.77.6.48355 > 208.71.187.83.443: Flags [.], ack 1, win 410, options [nop,nop,TS val 1251401 ecr 3230051312], length 0
```
- Second

```
===== tun0
10:56:37.395567 IP 10.80.77.6.56518 > 208.71.185.244.443: Flags [S], seq 4123762860, win 14600, options [mss 1460,sackOK,TS val 1250910 ecr 0,nop,wscale 6], length 0
10:56:37.645576 IP 208.71.185.244.443 > 10.80.77.6.56518: Flags [S.], seq 1696152267, ack 4123762861, win 14480, options [mss 1352,sackOK,TS val 1201248554 ecr 1250910,nop,wscale 9], length 0
10:56:37.645678 IP 10.80.77.6.56518 > 208.71.185.244.443: Flags [.], ack 1, win 229, options [nop,nop,TS val 1250960 ecr 1201248554], length 0
10:56:37.647517 IP 10.80.77.6.56518 > 208.71.185.244.443: Flags [P.], seq 1:238, ack 1, win 229, options [nop,nop,TS val 1250960 ecr 1201248554], length 237
10:56:37.796189 IP 208.71.185.244.443 > 10.80.77.6.56518: Flags [.], seq 1:1341, ack 238, win 31, options [nop,nop,TS val 1201248618 ecr 1250960], length 1340
10:56:37.796397 IP 208.71.185.244.443 > 10.80.77.6.56518: Flags [.], seq 1341:2681, ack 238, win 31, options [nop,nop,TS val 1201248618 ecr 1250960], length 1340
10:56:37.796559 IP 208.71.185.244.443 > 10.80.77.6.56518: Flags [P.], seq 2681:3796, ack 238, win 31, options [nop,nop,TS val 1201248618 ecr 1250960], length 1115
10:56:37.796713 IP 10.80.77.6.56518 > 208.71.185.244.443: Flags [.], ack 1341, win 274, options [nop,nop,TS val 1250990 ecr 1201248618], length 0
10:56:37.796781 IP 10.80.77.6.56518 > 208.71.185.244.443: Flags [.], ack 2681, win 319, options [nop,nop,TS val 1250990 ecr 1201248618], length 0
10:56:37.796833 IP 10.80.77.6.56518 > 208.71.185.244.443: Flags [.], ack 3796, win 364, options [nop,nop,TS val 1250990 ecr 1201248618], length 0
10:56:37.801241 IP 10.80.77.6.56518 > 208.71.185.244.443: Flags [P.], seq 238:552, ack 3796, win 364, options [nop,nop,TS val 1250991 ecr 1201248618], length 314
10:56:37.950448 IP 208.71.185.244.443 > 10.80.77.6.56518: Flags [P.], seq 3796:3843, ack 552, win 33, options [nop,nop,TS val 1201248656 ecr 1250991], length 47
10:56:37.951177 IP 10.80.77.6.56518 > 208.71.185.244.443: Flags [P.], seq 552:850, ack 3843, win 364, options [nop,nop,TS val 1251021 ecr 1201248656], length 298
10:56:38.099746 IP 208.71.185.244.443 > 10.80.77.6.56518: Flags [P.], seq 3843:4481, ack 850, win 35, options [nop,nop,TS val 1201248695 ecr 1251021], length 638
10:56:38.100387 IP 10.80.77.6.56518 > 208.71.185.244.443: Flags [P.], seq 850:877, ack 4481, win 410, options [nop,nop,TS val 1251051 ecr 1201248695], length 27
10:56:38.100549 IP 10.80.77.6.56518 > 208.71.185.244.443: Flags [F.], seq 877, ack 4481, win 410, options [nop,nop,TS val 1251051 ecr 1201248695], length 0
10:56:38.255630 IP 208.71.185.244.443 > 10.80.77.6.56518: Flags [P.], seq 4481:4508, ack 878, win 35, options [nop,nop,TS val 1201248732 ecr 1251051], length 27

===== wlan0
10:56:38.255781 IP 10.80.77.6.56518 > 208.71.185.244.443: Flags [R], seq 4123763738, win 0, length 0

===== tun0
10:56:38.256258 IP 208.71.185.244.443 > 10.80.77.6.56518: Flags [F.], seq 4508, ack 878, win 35, options [nop,nop,TS val 1201248732 ecr 1251051], length 0

===== wlan0
10:56:38.256358 IP 10.80.77.6.56518 > 208.71.185.244.443: Flags [R], seq 4123763738, win 0, length 0

===== tun0
10:56:38.904789 IP 208.71.185.244.443 > 10.80.77.6.56518: Flags [P.], seq 4481:4508, ack 878, win 35, options [nop,nop,TS val 1201248897 ecr 1251051], length 27

===== wlan0
10:56:38.904934 IP 10.80.77.6.56518 > 208.71.185.244.443: Flags [R], seq 4123763738, win 0, length 0

===== tun0
10:56:40.235406 IP 208.71.185.244.443 > 10.80.77.6.56518: Flags [P.], seq 4481:4508, ack 878, win 35, options [nop,nop,TS val 1201249228 ecr 1251051], length 27

===== wlan0
10:56:40.235504 IP 10.80.77.6.56518 > 208.71.185.244.443: Flags [R], seq 4123763738, win 0, length 0

===== tun0
10:56:42.876732 IP 208.71.185.244.443 > 10.80.77.6.56518: Flags [P.], seq 4481:4508, ack 878, win 35, options [nop,nop,TS val 1201249890 ecr 1251051], length 27

===== wlan0
10:56:42.876834 IP 10.80.77.6.56518 > 208.71.185.244.443: Flags [R], seq 4123763738, win 0, length 0
```

Any ideas how to further debug this? May it happens because of bug in handling `state ESTABLISHED` rule in iptables (conntracking had some bugs here AFAIR)?

**Comment by powerman** [comment]
@ukanth Can you please take a look at previous comment - may this issue be related to AFWall or iptables (my phone's kernel is 3.0.64-CM-ge2f984e)?

**Comment by aungtun1988** [comment]
tta-------- Original Message --------Subject: Re: [ics-openvpn] packets leaking (#346)From: Alex Efros To: schwabe/ics-openvpn CC: @ukanth Can you please take a look at previous comment - may this issue be related to AFWall or iptables (my phone's kernel is 3.0.64-CM-ge2f984e).

**Comment by aungtun1988** [comment]
#346

**Comment by schwabe** [comment]
@powerman Debugging that stuff requires looking at the iptables, policy routing etc. very hard. I never did that because it is outside of something the app can handle/fix. So, sorry no idea there. 

There were also a lot of fixes to that policy VPN routing in 5.0/5.1. The bug might not be there on newer Android versions. From my experience Android 4.4.x is one of the sketchist versions when it comes to VPN support.

**Comment by powerman** [comment]
4.4.4 is the latest available CM for this phone. Latest Samsung's is 4.1.2 AFAIR. So I can't try 5.x. :(

**Comment by schwabe** [comment]
@powerman Yes, I know that problem. I just wanted to point out that debugging 4.4.4 might be wasting time to find bugs that have already been fixed.

**Comment by LoveMyBaby** [comment]
@schwabe 
I encountered the same problem,android api 22.
here is my log:

2016-02-20 10:57:39 正式版本 0.6.47 running on oneplus A0001 (MSM8974), Android 5.1.1 (LMY48G) API 22, ABI armeabi-v7a, (oneplus/bacon/A0001:5.0.2/LRX22G/YNG1TAS2I3:user/release-keys)
2016-02-20 10:57:39 正在生成配置
2016-02-20 10:57:39 started Socket Thread
2016-02-20 10:57:40 Current Parameter Settings:
2016-02-20 10:57:40   config = '/data/data/de.blinkt.openvpn/cache/android.conf'
2016-02-20 10:57:40   mode = 0
2016-02-20 10:57:40   show_ciphers = DISABLED
2016-02-20 10:57:40   show_digests = DISABLED
2016-02-20 10:57:40   show_engines = DISABLED
2016-02-20 10:57:40   genkey = DISABLED
2016-02-20 10:57:40   key_pass_file = '[UNDEF]'
2016-02-20 10:57:40   show_tls_ciphers = DISABLED
2016-02-20 10:57:40   connect_retry_max = 5
2016-02-20 10:57:40 Connection profiles [0]:
2016-02-20 10:57:40   proto = tcp-client
2016-02-20 10:57:40   local = '[UNDEF]'
2016-02-20 10:57:40   local_port = '[UNDEF]'
2016-02-20 10:57:40   remote = '43.251.xxx.xx'
2016-02-20 10:57:40   remote_port = '80'
2016-02-20 10:57:40   remote_float = DISABLED
2016-02-20 10:57:40   bind_defined = DISABLED
2016-02-20 10:57:40   bind_local = DISABLED
2016-02-20 10:57:40   bind_ipv6_only = DISABLED
2016-02-20 10:57:40   connect_retry_seconds = 5
2016-02-20 10:57:40   connect_timeout = 120
2016-02-20 10:57:40   socks_proxy_server = '[UNDEF]'
2016-02-20 10:57:40   socks_proxy_port = '[UNDEF]'
2016-02-20 10:57:40   socks_proxy_retry = DISABLED
2016-02-20 10:57:40   tun_mtu = 1500
2016-02-20 10:57:40   tun_mtu_defined = ENABLED
2016-02-20 10:57:40   link_mtu = 1500
2016-02-20 10:57:40   link_mtu_defined = DISABLED
2016-02-20 10:57:40   tun_mtu_extra = 0
2016-02-20 10:57:40   tun_mtu_extra_defined = DISABLED
2016-02-20 10:57:40   mtu_discover_type = -1
2016-02-20 10:57:40   fragment = 0
2016-02-20 10:57:40   mssfix = 1450
2016-02-20 10:57:40   explicit_exit_notification = 0
2016-02-20 10:57:40 Connection profiles END
2016-02-20 10:57:40   remote_random = DISABLED
2016-02-20 10:57:40   ipchange = '[UNDEF]'
2016-02-20 10:57:40   dev = 'tun'
2016-02-20 10:57:40   dev_type = '[UNDEF]'
2016-02-20 10:57:40   dev_node = '[UNDEF]'
2016-02-20 10:57:40   lladdr = '[UNDEF]'
2016-02-20 10:57:40   topology = 1
2016-02-20 10:57:40   tun_ipv6 = DISABLED
2016-02-20 10:57:40   ifconfig_local = '[UNDEF]'
2016-02-20 10:57:40   ifconfig_remote_netmask = '[UNDEF]'
2016-02-20 10:57:40   ifconfig_noexec = DISABLED
2016-02-20 10:57:40   ifconfig_nowarn = ENABLED
2016-02-20 10:57:40   ifconfig_ipv6_local = '[UNDEF]'
2016-02-20 10:57:40   ifconfig_ipv6_netbits = 0
2016-02-20 10:57:40   ifconfig_ipv6_remote = '[UNDEF]'
2016-02-20 10:57:40   shaper = 0
2016-02-20 10:57:40   mtu_test = 0
2016-02-20 10:57:40   mlock = DISABLED
2016-02-20 10:57:40   keepalive_ping = 0
2016-02-20 10:57:40   keepalive_timeout = 0
2016-02-20 10:57:40   inactivity_timeout = 0
2016-02-20 10:57:40   ping_send_timeout = 0
2016-02-20 10:57:40   ping_rec_timeout = 0
2016-02-20 10:57:40   ping_rec_timeout_action = 0
2016-02-20 10:57:40   ping_timer_remote = DISABLED
2016-02-20 10:57:40   remap_sigusr1 = 0
2016-02-20 10:57:40   persist_tun = DISABLED
2016-02-20 10:57:40   persist_local_ip = DISABLED
2016-02-20 10:57:40   persist_remote_ip = DISABLED
2016-02-20 10:57:40   persist_key = DISABLED
2016-02-20 10:57:40   passtos = DISABLED
2016-02-20 10:57:40   resolve_retry_seconds = 60
2016-02-20 10:57:40   resolve_in_advance = DISABLED
2016-02-20 10:57:40   username = '[UNDEF]'
2016-02-20 10:57:40   groupname = '[UNDEF]'
2016-02-20 10:57:40   chroot_dir = '[UNDEF]'
2016-02-20 10:57:40   cd_dir = '[UNDEF]'
2016-02-20 10:57:40   writepid = '[UNDEF]'
2016-02-20 10:57:40   up_script = '[UNDEF]'
2016-02-20 10:57:40   down_script = '[UNDEF]'
2016-02-20 10:57:40   down_pre = DISABLED
2016-02-20 10:57:40   up_restart = DISABLED
2016-02-20 10:57:40   up_delay = DISABLED
2016-02-20 10:57:40   daemon = DISABLED
2016-02-20 10:57:40   inetd = 0
2016-02-20 10:57:40   log = DISABLED
2016-02-20 10:57:40   suppress_timestamps = DISABLED
2016-02-20 10:57:40   machine_readable_output = ENABLED
2016-02-20 10:57:40   nice = 0
2016-02-20 10:57:40   verbosity = 4
2016-02-20 10:57:40   mute = 0
2016-02-20 10:57:40   gremlin = 0
2016-02-20 10:57:40   status_file = '[UNDEF]'
2016-02-20 10:57:40   status_file_version = 1
2016-02-20 10:57:40   status_file_update_freq = 60
2016-02-20 10:57:40   occ = ENABLED
2016-02-20 10:57:40   rcvbuf = 0
2016-02-20 10:57:40   sndbuf = 0
2016-02-20 10:57:40   sockflags = 0
2016-02-20 10:57:40   fast_io = DISABLED
2016-02-20 10:57:40   comp.alg = 0
2016-02-20 10:57:40   comp.flags = 0
2016-02-20 10:57:40   route_script = '[UNDEF]'
2016-02-20 10:57:40 网络状态： CONNECTED  to WIFI "ken"
2016-02-20 10:57:40   route_default_gateway = '[UNDEF]'
2016-02-20 10:57:40   route_default_metric = 0
2016-02-20 10:57:40   route_noexec = DISABLED
2016-02-20 10:57:40   route_delay = 0
2016-02-20 10:57:40   route_delay_window = 30
2016-02-20 10:57:40   route_delay_defined = DISABLED
2016-02-20 10:57:40   route_nopull = DISABLED
2016-02-20 10:57:40   route_gateway_via_dhcp = DISABLED
2016-02-20 10:57:40   allow_pull_fqdn = DISABLED
2016-02-20 10:57:40   route 0.0.0.0/0.0.0.0/vpn_gateway/nil
2016-02-20 10:57:40   management_addr = '/data/data/de.blinkt.openvpn/cache/mgmtsocket'
2016-02-20 10:57:40   management_port = 'unix'
2016-02-20 10:57:40   management_user_pass = '[UNDEF]'
2016-02-20 10:57:40   management_log_history_cache = 250
2016-02-20 10:57:40   management_echo_buffer_size = 100
2016-02-20 10:57:40   management_write_peer_info_file = '[UNDEF]'
2016-02-20 10:57:40   management_client_user = '[UNDEF]'
2016-02-20 10:57:40   management_client_group = '[UNDEF]'
2016-02-20 10:57:40   management_flags = 294
2016-02-20 10:57:40   shared_secret_file = '[UNDEF]'
2016-02-20 10:57:40   key_direction = 0
2016-02-20 10:57:40   ciphername_defined = ENABLED
2016-02-20 10:57:40   ciphername = 'BF-CBC'
2016-02-20 10:57:40   authname_defined = ENABLED
2016-02-20 10:57:40   authname = 'SHA1'
2016-02-20 10:57:40   prng_hash = 'SHA1'
2016-02-20 10:57:40   prng_nonce_secret_len = 16
2016-02-20 10:57:40   keysize = 0
2016-02-20 10:57:40   engine = DISABLED
2016-02-20 10:57:40   replay = ENABLED
2016-02-20 10:57:40   mute_replay_warnings = DISABLED
2016-02-20 10:57:40   replay_window = 64
2016-02-20 10:57:40   replay_time = 15
2016-02-20 10:57:40   packet_id_file = '[UNDEF]'
2016-02-20 10:57:40   use_iv = ENABLED
2016-02-20 10:57:40   test_crypto = DISABLED
2016-02-20 10:57:40   tls_server = DISABLED
2016-02-20 10:57:40   tls_client = ENABLED
2016-02-20 10:57:40   key_method = 2
2016-02-20 10:57:40   ca_file = '[[INLINE]]'
2016-02-20 10:57:40   ca_path = '[UNDEF]'
2016-02-20 10:57:40   dh_file = '[UNDEF]'
2016-02-20 10:57:40   cert_file = '[UNDEF]'
2016-02-20 10:57:40   extra_certs_file = '[UNDEF]'
2016-02-20 10:57:40   priv_key_file = '[UNDEF]'
2016-02-20 10:57:40   pkcs12_file = '[UNDEF]'
2016-02-20 10:57:40   cipher_list = '[UNDEF]'
2016-02-20 10:57:40   tls_verify = '[UNDEF]'
2016-02-20 10:57:40   tls_export_cert = '[UNDEF]'
2016-02-20 10:57:40   verify_x509_type = 2
2016-02-20 10:57:40   verify_x509_name = '43.251.xxx.xx'
2016-02-20 10:57:40   crl_file = '[UNDEF]'
2016-02-20 10:57:40   ns_cert_type = 0
2016-02-20 10:57:40   remote_cert_ku[i] = 0
2016-02-20 10:57:40   remote_cert_ku[i] = 0
2016-02-20 10:57:40   remote_cert_ku[i] = 0
2016-02-20 10:57:40   remote_cert_ku[i] = 0
2016-02-20 10:57:40   remote_cert_ku[i] = 0
2016-02-20 10:57:40   remote_cert_ku[i] = 0
2016-02-20 10:57:40   remote_cert_ku[i] = 0
2016-02-20 10:57:40   remote_cert_ku[i] = 0
2016-02-20 10:57:40   remote_cert_ku[i] = 0
2016-02-20 10:57:40   remote_cert_ku[i] = 0
2016-02-20 10:57:40   remote_cert_ku[i] = 0
2016-02-20 10:57:40   remote_cert_ku[i] = 0
2016-02-20 10:57:40   remote_cert_ku[i] = 0
2016-02-20 10:57:40   remote_cert_ku[i] = 0
2016-02-20 10:57:40   remote_cert_ku[i] = 0
2016-02-20 10:57:40   remote_cert_ku[i] = 0
2016-02-20 10:57:40   remote_cert_eku = '[UNDEF]'
2016-02-20 10:57:40   ssl_flags = 0
2016-02-20 10:57:40   tls_timeout = 2
2016-02-20 10:57:40   renegotiate_bytes = 0
2016-02-20 10:57:40   renegotiate_packets = 0
2016-02-20 10:57:40   renegotiate_seconds = 3600
2016-02-20 10:57:40   handshake_window = 60
2016-02-20 10:57:40   transition_window = 3600
2016-02-20 10:57:40   single_session = DISABLED
2016-02-20 10:57:40   push_peer_info = DISABLED
2016-02-20 10:57:40   tls_exit = DISABLED
2016-02-20 10:57:40   tls_auth_file = '[UNDEF]'
2016-02-20 10:57:40   client = ENABLED
2016-02-20 10:57:40   pull = ENABLED
2016-02-20 10:57:40   auth_user_pass_file = 'stdin'
2016-02-20 10:57:40 OpenVPN 2.4-icsopenvpn [git:icsopenvpn-c75f06c933a596fb] android-14-armeabi-v7a [SSL (OpenSSL)] [LZO] [LZ4] [EPOLL] [MH] [IPv6] built on Feb 10 2016
2016-02-20 10:57:40 library versions: OpenSSL 1.0.2f  28 Jan 2016, LZO 2.09
2016-02-20 10:57:40 MANAGEMENT: Connected to management server at /data/data/de.blinkt.openvpn/cache/mgmtsocket
2016-02-20 10:57:40 MANAGEMENT: CMD 'hold release'
2016-02-20 10:57:40 MANAGEMENT: CMD 'username 'Auth' gnosis'
2016-02-20 10:57:40 MANAGEMENT: CMD 'bytecount 2'
2016-02-20 10:57:40 MANAGEMENT: CMD 'password [...]'
2016-02-20 10:57:40 Control Channel MTU parms [ L:1543 D:1210 EF:40 EB:0 ET:0 EL:3 ]
2016-02-20 10:57:40 Data Channel MTU parms [ L:1543 D:1450 EF:43 EB:393 ET:0 EL:3 ]
2016-02-20 10:57:40 Local Options String (VER=V4): 'V4,dev-type tun,link-mtu 1543,tun-mtu 1500,proto TCPv4_CLIENT,cipher BF-CBC,auth SHA1,keysize 128,key-method 2,tls-client'
2016-02-20 10:57:40 Expected Remote Options String (VER=V4): 'V4,dev-type tun,link-mtu 1543,tun-mtu 1500,proto TCPv4_SERVER,cipher BF-CBC,auth SHA1,keysize 128,key-method 2,tls-server'
2016-02-20 10:57:40 TCP/UDP: Preserving recently used remote address: [AF_INET]43.251.xxx.xx:80
2016-02-20 10:57:40 Socket Buffers: R=[1048576->1048576] S=[524288->524288]
2016-02-20 10:57:40 Attempting to establish TCP connection with [AF_INET]43.251.xxx.xx:80 [nonblock]
2016-02-20 10:57:40 MANAGEMENT: CMD 'state on'
2016-02-20 10:57:40 MANAGEMENT: CMD 'needok 'PROTECTFD' ok'
2016-02-20 10:57:41 TCP connection established with [AF_INET]43.251.xxx.xx:80
2016-02-20 10:57:41 MANAGEMENT: CMD 'needok 'PROTECTFD' ok'
2016-02-20 10:57:41 TCP_CLIENT link local: (not bound)
2016-02-20 10:57:41 TCP_CLIENT link remote: [AF_INET]43.251.xxx.xx:80
2016-02-20 10:57:41 MANAGEMENT: >STATE:1455937061,WAIT,,,,,,
2016-02-20 10:57:41 Connection reset, restarting [-1]
2016-02-20 10:57:41 TCP/UDP: Closing socket
2016-02-20 10:57:41 SIGUSR1[soft,connection-reset] received, process restarting
2016-02-20 10:57:41 MANAGEMENT: >STATE:1455937061,RECONNECTING,connection-reset,,,,,
2016-02-20 10:57:44 MANAGEMENT: CMD 'hold release'
2016-02-20 10:57:44 Control Channel MTU parms [ L:1543 D:1210 EF:40 EB:0 ET:0 EL:3 ]
2016-02-20 10:57:44 Data Channel MTU parms [ L:1543 D:1450 EF:43 EB:393 ET:0 EL:3 ]
2016-02-20 10:57:44 Local Options String (VER=V4): 'V4,dev-type tun,link-mtu 1543,tun-mtu 1500,proto TCPv4_CLIENT,cipher BF-CBC,auth SHA1,keysize 128,key-method 2,tls-client'
2016-02-20 10:57:44 Expected Remote Options String (VER=V4): 'V4,dev-type tun,link-mtu 1543,tun-mtu 1500,proto TCPv4_SERVER,cipher BF-CBC,auth SHA1,keysize 128,key-method 2,tls-server'
2016-02-20 10:57:44 TCP/UDP: Preserving recently used remote address: [AF_INET]43.251.xxx.xx:80
2016-02-20 10:57:44 Socket Buffers: R=[1048576->1048576] S=[524288->524288]
2016-02-20 10:57:44 Attempting to establish TCP connection with [AF_INET]43.251.xxx.xx:80 [nonblock]
2016-02-20 10:57:44 MANAGEMENT: >STATE:1455937064,TCP_CONNECT,,,,,,
2016-02-20 10:57:44 MANAGEMENT: CMD 'bytecount 2'
2016-02-20 10:57:44 MANAGEMENT: CMD 'state on'
2016-02-20 10:57:44 MANAGEMENT: CMD 'needok 'PROTECTFD' ok'
2016-02-20 10:57:45 TCP connection established with [AF_INET]43.251.xxx.xx:80
2016-02-20 10:57:45 MANAGEMENT: CMD 'needok 'PROTECTFD' ok'
2016-02-20 10:57:45 TCP_CLIENT link local: (not bound)
2016-02-20 10:57:45 TCP_CLIENT link remote: [AF_INET]43.251.xxx.xx:80
2016-02-20 10:57:45 MANAGEMENT: >STATE:1455937065,WAIT,,,,,,
2016-02-20 10:57:45 Connection reset, restarting [-1]
2016-02-20 10:57:45 TCP/UDP: Closing socket
2016-02-20 10:57:45 SIGUSR1[soft,connection-reset] received, process restarting
2016-02-20 10:57:45 MANAGEMENT: >STATE:1455937065,RECONNECTING,connection-reset,,,,,
2016-02-20 10:57:48 MANAGEMENT: CMD 'hold release'
2016-02-20 10:57:48 Control Channel MTU parms [ L:1543 D:1210 EF:40 EB:0 ET:0 EL:3 ]
2016-02-20 10:57:48 Data Channel MTU parms [ L:1543 D:1450 EF:43 EB:393 ET:0 EL:3 ]
2016-02-20 10:57:48 Local Options String (VER=V4): 'V4,dev-type tun,link-mtu 1543,tun-mtu 1500,proto TCPv4_CLIENT,cipher BF-CBC,auth SHA1,keysize 128,key-method 2,tls-client'
2016-02-20 10:57:48 Expected Remote Options String (VER=V4): 'V4,dev-type tun,link-mtu 1543,tun-mtu 1500,proto TCPv4_SERVER,cipher BF-CBC,auth SHA1,keysize 128,key-method 2,tls-server'
2016-02-20 10:57:48 TCP/UDP: Preserving recently used remote address: [AF_INET]43.251.xxx.xx:80
2016-02-20 10:57:48 Socket Buffers: R=[1048576->1048576] S=[524288->524288]
2016-02-20 10:57:48 Attempting to establish TCP connection with [AF_INET]43.251.xxx.xx:80 [nonblock]
2016-02-20 10:57:48 MANAGEMENT: >STATE:1455937068,TCP_CONNECT,,,,,,
2016-02-20 10:57:48 MANAGEMENT: CMD 'bytecount 2'
2016-02-20 10:57:48 MANAGEMENT: CMD 'state on'
2016-02-20 10:57:48 MANAGEMENT: CMD 'needok 'PROTECTFD' ok'
2016-02-20 10:57:49 TCP connection established with [AF_INET]43.251.xxx.xx:80
2016-02-20 10:57:49 MANAGEMENT: CMD 'needok 'PROTECTFD' ok'
2016-02-20 10:57:49 TCP_CLIENT link local: (not bound)
2016-02-20 10:57:49 TCP_CLIENT link remote: [AF_INET]43.251.xxx.xx:80
2016-02-20 10:57:49 MANAGEMENT: >STATE:1455937069,WAIT,,,,,,
2016-02-20 10:57:49 Connection reset, restarting [-1]
2016-02-20 10:57:49 TCP/UDP: Closing socket
2016-02-20 10:57:49 SIGUSR1[soft,connection-reset] received, process restarting
2016-02-20 10:57:49 MANAGEMENT: >STATE:1455937069,RECONNECTING,connection-reset,,,,,
2016-02-20 10:57:52 MANAGEMENT: CMD 'hold release'
2016-02-20 10:57:52 Control Channel MTU parms [ L:1543 D:1210 EF:40 EB:0 ET:0 EL:3 ]
2016-02-20 10:57:52 Data Channel MTU parms [ L:1543 D:1450 EF:43 EB:393 ET:0 EL:3 ]
2016-02-20 10:57:52 Local Options String (VER=V4): 'V4,dev-type tun,link-mtu 1543,tun-mtu 1500,proto TCPv4_CLIENT,cipher BF-CBC,auth SHA1,keysize 128,key-method 2,tls-client'
2016-02-20 10:57:52 Expected Remote Options String (VER=V4): 'V4,dev-type tun,link-mtu 1543,tun-mtu 1500,proto TCPv4_SERVER,cipher BF-CBC,auth SHA1,keysize 128,key-method 2,tls-server'
2016-02-20 10:57:52 TCP/UDP: Preserving recently used remote address: [AF_INET]43.251.xxx.xx:80
2016-02-20 10:57:52 Socket Buffers: R=[1048576->1048576] S=[524288->524288]
2016-02-20 10:57:52 Attempting to establish TCP connection with [AF_INET]43.251.xxx.xx:80 [nonblock]
2016-02-20 10:57:52 MANAGEMENT: >STATE:1455937072,TCP_CONNECT,,,,,,
2016-02-20 10:57:52 MANAGEMENT: CMD 'bytecount 2'
2016-02-20 10:57:52 MANAGEMENT: CMD 'state on'
2016-02-20 10:57:52 MANAGEMENT: CMD 'needok 'PROTECTFD' ok'
2016-02-20 10:57:53 TCP connection established with [AF_INET]43.251.xxx.xx:80
2016-02-20 10:57:53 MANAGEMENT: CMD 'needok 'PROTECTFD' ok'
2016-02-20 10:57:53 TCP_CLIENT link local: (not bound)
2016-02-20 10:57:53 TCP_CLIENT link remote: [AF_INET]43.251.xxx.xx:80
2016-02-20 10:57:53 MANAGEMENT: >STATE:1455937073,WAIT,,,,,,
2016-02-20 10:57:53 Connection reset, restarting [-1]
2016-02-20 10:57:53 TCP/UDP: Closing socket
2016-02-20 10:57:53 SIGUSR1[soft,connection-reset] received, process restarting
2016-02-20 10:57:53 MANAGEMENT: >STATE:1455937073,RECONNECTING,connection-reset,,,,,
2016-02-20 10:57:56 MANAGEMENT: CMD 'hold release'
2016-02-20 10:57:56 Control Channel MTU parms [ L:1543 D:1210 EF:40 EB:0 ET:0 EL:3 ]
2016-02-20 10:57:56 Data Channel MTU parms [ L:1543 D:1450 EF:43 EB:393 ET:0 EL:3 ]
2016-02-20 10:57:56 Local Options String (VER=V4): 'V4,dev-type tun,link-mtu 1543,tun-mtu 1500,proto TCPv4_CLIENT,cipher BF-CBC,auth SHA1,keysize 128,key-method 2,tls-client'
2016-02-20 10:57:56 Expected Remote Options String (VER=V4): 'V4,dev-type tun,link-mtu 1543,tun-mtu 1500,proto TCPv4_SERVER,cipher BF-CBC,auth SHA1,keysize 128,key-method 2,tls-server'
2016-02-20 10:57:56 TCP/UDP: Preserving recently used remote address: [AF_INET]43.251.xxx.xx:80
2016-02-20 10:57:56 Socket Buffers: R=[1048576->1048576] S=[524288->524288]
2016-02-20 10:57:56 Attempting to establish TCP connection with [AF_INET]43.251.xxx.xx:80 [nonblock]
2016-02-20 10:57:56 MANAGEMENT: >STATE:1455937076,TCP_CONNECT,,,,,,
2016-02-20 10:57:56 MANAGEMENT: CMD 'bytecount 2'
2016-02-20 10:57:56 MANAGEMENT: CMD 'state on'
2016-02-20 10:57:56 MANAGEMENT: CMD 'needok 'PROTECTFD' ok'
2016-02-20 10:57:57 TCP connection established with [AF_INET]43.251.xxx.xx:80
2016-02-20 10:57:57 MANAGEMENT: CMD 'needok 'PROTECTFD' ok'
2016-02-20 10:57:57 TCP_CLIENT link local: (not bound)
2016-02-20 10:57:57 TCP_CLIENT link remote: [AF_INET]43.251.xxx.xx:80
2016-02-20 10:57:57 MANAGEMENT: >STATE:1455937077,WAIT,,,,,,
2016-02-20 10:57:57 Connection reset, restarting [-1]
2016-02-20 10:57:57 TCP/UDP: Closing socket
2016-02-20 10:57:57 SIGUSR1[soft,connection-reset] received, process restarting
2016-02-20 10:57:57 MANAGEMENT: >STATE:1455937077,RECONNECTING,connection-reset,,,,,
2016-02-20 10:58:00 MANAGEMENT: CMD 'hold release'
2016-02-20 10:58:00 MANAGEMENT: Client disconnected
2016-02-20 10:58:00 All connections have been connect-retry-max (5) times unsuccessful, exiting
2016-02-20 10:58:00 Exiting due to fatal error
2016-02-20 10:58:00 Process exited with exit value 1
2016-02-20 10:58:00 MGMT: Got unrecognized command>FATAL:All connections have been connect-retry-max (5) times unsuccessful, exiting

**Comment by schwabe** [comment]
@LoveMyBaby your problem is that your VPN connection is not working probably.
