### ISSUE TITLE
HTTP Proxy Problem

### ISSUE THREAD

**Issue by ghost** [schwabe/ics-openvpn#380]
Here's my config :
# 

client
dev tun
proto tcp
remote-random
remote xxx xx
resolv-retry infinite
route-method exe
resolv-retry infinite
nobind
persist-key
persist-tun
auth-user-pass
comp-lzo
verb 3

http-proxy xxx xxx
http-proxy-retry
http-proxy-timeout 2
http-proxy-option CUSTOM-HEADER Host http://xxxxxxxxxx/
http-proxy-option CUSTOM-HEADER X-Online-Host xxx.xx.xxx
# 

Resut : 

TCP Connection Established, but got this :
MGMT:Got unrecognized line from management:ERROR: no needok-confirmation is 
currently needed at this time

---

The same config imported on OpenVPN Connect ( Official OpenVPN App ) didn't have any problem to connect.

Should I modified something to correct this?

**Comment by ghost** [comment]
![logandroid](https://cloud.githubusercontent.com/assets/12457875/9031248/bdc1b310-39e2-11e5-8dfa-a4c7b251281a.jpg)

**Comment by schwabe** [comment]
While there is some bug in there for the need-ok command that is not the problem of not connecting. The proxy you are using does not seem to work.

**Comment by xDragonZ** [comment]
Should be related to the current openvpn code base, with openvpn connect indeed doesn't have this issue such as openvpn are able to connect proxy if there's 302 header status because isp trying to redirect to another page.

**Comment by schwabe** [comment]
Yes, but then it is a openvpn bug and please report it to the main project. Handling 302 in a CONNECT is nontrivial.

**Comment by ghost** [comment]
@schwabe The proxy is working, I setup the proxy myself ( squid ), and only allow certain IP address to connect through it. There was no 302 error while connecting to OpenVPN Official app.

**Comment by schwabe** [comment]
@neviel47 Then please try to get tcpdump (or similar, a nc -l -p 8080 should work) of the request of OpenVPN Connect and OpenVPN for Android.

**Comment by ghost** [comment]
@schwabe 

Here's TCPDump Log  :

tcpdump -A -i eth0 'port 8080'

OpenVPN for Android ( VPN Not Connected )

---

..!..?.J
13:28:48.483392 IP 115.164.210.24.32506 > xxxxxxxxxx.squid: Flags [FP.], seq 37:106, ack 1, win 7300, options [nop,nop,TS val 16262158 ecr 4198436682], length 69
E..y..@.8..Is.......~..8        -...[......"+.....
..$..?.JHost: http://orange.deezer.com/
X-Online-Host: orange.deezer.com

13:28:48.483413 IP xxxxxxxxxx.squid > 115.164.210.24.32506: Flags [.], ack 1, win 57, options [nop,nop,TS val 4198439724 ecr 16261598,nop,nop,sack 1 {37:107}], length 0
E..@..@.@..l....s....8~..[..    -.....9.V.....
.?.,..!....
        -..     -.!
13:28:49.932381 IP 115.164.210.24.13152 > xxxxxxxxx.squid: Flags [P.], seq 1:37, ack 1, win 7300, options [nop,nop,TS val 16262456 ecr 4198433613], length 36
E..X.r@.8.+.s.......3`.8...I..D............
..%8.?.MCONNECT 128.199.xx.xx:138 HTTP/1.0

13:28:49.932407 IP xxxxxxxxx.squid > 115.164.210.24.13152: Flags [.], ack 107, win 57, options [nop,nop,TS val 4198441173 ecr 16262456], length 0
E..4.h@.@../....s....83`..D........9.b.....
.? ...%8
13:28:49.936729 IP xxxxxx.com.squid > 115.164.210.24.13152: Flags [P.], seq 1:40, ack 107, win 57, options [nop,nop,TS val 4198441177 ecr 16262456], length 39
E..[.i@.@.......s....83`..D........9az.....
.? ...%8HTTP/1.0 200 Connection established

13:28:49.937578 IP xxx.squid > 115.164.210.24.13152: Flags [F.], seq 40, ack 107, win 57, options [nop,nop,TS val 4198441178 ecr 16262456], length 0
E..4.j@.@..-....s....83`..D*.......9.5.....
.? ...%8
13:28:50.081971 IP 115.164.210.24.13152 > xxx.squid: Flags [R], seq 397912755, win 0, length 0
E..(..@.8...s.......3`.8........P...L.........
13:28:50.082098 IP 115.164.210.24.13152 > xxx.squid: Flags [R], seq 397912755, win 0, length 0
E..(..@.8...s.......3`.8........P...L.........
13:28:51.532496 IP 115.164.210.24.51759 > xxx.squid: Flags [S], seq 1787465725, win 14600, options [mss 1360,sackOK,TS val 16262776 ecr 0,nop,wscale 1], length 0
E..<..@.8.8

---

OpenVPN Connect ( VPN Connected )

---

13:20:00.363900 IP xxxxxxxxxx.com.squid > 115.164.210.24.58639: Flags [F.], seq 40, ack 61, win 57, options [nop,nop,TS val 4197911604 ecr 16156537], length 0
E..4.b@.@..5....s....8....>..~.l...9r......
.7.4...y
13:20:00.508973 IP 115.164.210.24.58639 > xx.xxx.squid: Flags [R], seq 243188588, win 0, length 0
E..(..@.8...s..........8.~.l....P.............
13:20:00.509190 IP 115.164.210.24.58639 > xx.xx.com.squid: Flags [R], seq 243188588, win 0, length 0
E..(..@.8...s..........8.~.l....P.............

b...b...
13:23:42.998962 IP 115.164.210.24.61838 > xxxxxxx.squid: Flags [P.], seq 1:106, ack 1, win 457, options [nop,nop,TS val 16201055 ecr 4198133672], length 105
E.....@.8..\s..........8.Z9.b..............
..5_.:o.CONNECT 128.199.xx.xx:138 HTTP/1.0
Host: http://orange.deezer.com/
X-Online-Host: orange.deezer.com

13:23:42.998980 IP xxxxxxxx.com.squid > 115.164.210.24.61838: Flags [.], ack 106, win 57, options [nop,nop,TS val 4198134239 ecr 16201055], length 0
E..4.`@.@.C7....s....8..b....Z:_...9\m.....
.:q...5_
13:23:43.002418 IP xxxxxx.com.squid > 115.164.210.24.61838: Flags [P.], seq 1:40, ack 106, win 57, options [nop,nop,TS val 4198134243 ecr 16201055], length 39
E..[.a@.@.C.....s....8..b....Z:_...9az.....
.:q...5_HTTP/1.0 200 Connection established

13:23:43.108723 IP 115.164.210.24.61838 > xxxxxxxx.com.squid: Flags [.], ack 40, win 457, options [nop,nop,TS val 16201107 ecr 4198134243], length 0
E..4..@.8...s..........8.Z:_b.......Z~.....
..5..:q.
13:23:43.109083 IP 115.164.210.24.61838 > xxx.squid: Flags [P.], seq 106:122, ack 40, win 457, options [nop,nop,TS val 16201108 ecr 4198134243], length 16
E..D..@.8...s..........8.Z:_b.......$......
..5..:q...8x....f}......

---

**Comment by schwabe** [comment]
Hm the request look identical. This may related to OpenVPNs very shot http-proxy-timeout of 5

Can you try http-proxy-timeout 60 as custom option and see what happens?

**Comment by ghost** [comment]
@schwabe 

Stuck at :

Send HTTP Proxy CONNECT 128.199.xx.xx:138 HTTP/1.0
Send HTTP Proxy Host: http://orange.deezer.com/
Send HTTP Proxy X-Online-Host: orange.deezer.com

for about 60 sec, then log same as screenshot above, just delayed.

**Comment by schwabe** [comment]
I have no idea left for you to try. To really debug this I would need to have proxy server against which OpenVPN shows this behaviour. Have you tried OpeNVPN on an other platform with that config? (Linux, Mac, Windows)

Arne

**Comment by schwabe** [comment]
Closing this bug since it is unclear how to reproduce the bug.

**Comment by noman720** [comment]
@ghost did you get any way to solve the issue? I am facing the similar problem.

**Comment by farhadsakhaei** [comment]
Same here too
